0,hp cartridge toner back give something office max cdw black packard hewlett color yield inc page gloves laserjet clark kimberly
1,vwr scientific dell inc label private international sterile fisher cs tips tube bd corning tip lp marketing llc pipet culture
2,office max something give back color size officemax white quantity unit black paper label private products 3m assorted box blue
3,scientific fisher inc vwr thermo chemical glass international products praxair cs millipore spectrum emd cas chemicals bottle size laboratories grade
4,inc grainger size type length material steel head width color dia max finish battery height 16 thread number package standards
5,aldrich sigma inc corporation life technologies laboratories bio rad new england biolabs thorlabs biotechnology cell santa cruz solution reg ml
