0,gloves inc free nitrile scientific supply fisher powder kimberly waxie products clark cs latex exam sanitary glove cuff vwr microflex
1,fisher scientific inc chemical cas thorlabs bottle glass organics acros international fw vwr mp acs bp certified acid 4l grade
2,scientific fisher cs sterile thermo corning tips fisherbrand filter bd disposable inc well tip cap polystyrene capacity clear rainin sciences
3,office max black give something back color sanford ink size point fine blue pen medium box chisel pens bic quantity
4,office max officemax white color size paper label give back private something quantity boise unit lb avery letter box recycled
5,hp dell cartridge toner cdw packard hewlett black max office yield color page laserjet back something give lp marketing brother
6,technologies corporation life praxair max back something office give oz inc distribution type lamp box reg quantity agilent unit size
7,inc grainger size length type material steel head width dia height finish battery 16 thread number package degrees color standards
8,aldrich sigma scientific corporation corp laboratories thermo fisher spectrum millipore chemicals emd digikey products solution cell pierce ml acid reagent
9,office max 3m back give something tape inc size color black post commercial unit div quantity assorted products yellow notes
10,vwr inc international label private tube new england biolabs llc sterile stanley stockroom neb polypropylene units bd centrifuge tubes glass
