0,hp cartridge toner packard hewlett yield black max office color page laserjet gloves clark kimberly nitrile free powder cartridges waxie
1,max office color black sanford size ink point blue fine pen medium chisel pens bic pilot retractable ballpoint markers gel
2,vwr scientific international inc label private sterile fisher cs tube bd corning tips polystyrene culture polypropylene well cap plastic pipet
3,inc corporation laboratories life technologies vwr products spectrum bio rad chemicals new international england biolabs emd millipore ml scientific reg
4,paper dell office max boise white lb size color sheets quantity unit lp marketing recycled use carton multi weight cascade
5,inc grainger length type size steel head material dia finish thread 16 lamp height number width degrees handle temp screw
6,sigma aldrich praxair corp distribution organics acros digikey grade acid solution purity sodium va corporation electronics high powder ultra nitrogen
7,inc cdw supply usb rainin biotechnology llc cruz santa cable instrument drive tips industries logitech book media complete ul johnson
8,inc grainger material size battery color type thorlabs width length frame package lens standards ansi black quantity gray safety belt
9,scientific fisher thermo chemical glass cs bottle fisherbrand cas filter inc size fw mp membrane cell pierce millipore bp certified
10,max office officemax size color label private quantity unit 3m white avery assorted black tape post box type letter tab
11,back give something box products office tape universal black white co commercial letter div sheet corp carton 3m batteries alkaline
